Related Search,Result 1,Result 2,Result 3,Result 4,Result 5
sancho jadon,Jadon Sancho - Wikipedia,Jadon Sancho (@sanchooo10) • Instagram photos and videos,Jadon Sancho - Player profile 23/24 | Transfermarkt,Jadon Sancho - Player profile 23/24 | Transfermarkt,Jadon Sancho (@Sanchooo10) / X
sancho panza,Sancho Panza - Wikipedia,"Sancho Panza | Don Quixote's Squire, Spanish Novel, Comic Relief ...",Don Quixote - Wikipedia,Sancho Panza The Original Robusto Review - Cigar Dojo,Sancho Panza - Hoppin' Summer Series - Throwback Brewery
el sancho,"El Sancho - Taco Shop and Mexican Food Bend, Oregon",El Sancho (@elsanchohi) • Instagram photos and videos,Menu – El Sancho,Taqueria El Sancho | McAllen TX,Catering – El Sancho
rodolfo sancho,Rodolfo Sancho - IMDb,Rodolfo Sancho - Wikipedia,Spanish actor Rodolfo Sancho Aguirre's son charged with murder ...,Rodolfo Sancho (@rodolfo_sancho) • Instagram photos and videos,"Rodolfo Sancho - Wikipedia, la enciclopedia libre"
sancho united,Jadon Sancho - Wikipedia,Jadon Sancho | Man Utd First Team Player Profile - Manchester United,Jadon Sancho - Player profile 23/24 | Transfermarkt,LIVE Transfer Talk: Man United open to Jadon Sancho offers - ESPN,"Jadon Sancho Manchester United Jerseys, Jadon Sancho Soccer ..."
